{
  "schema_version": "1.0.0",
  "profile_id": "lrgv_upper_mission_reliable_irrigation",
  "captured_at": "2026-08-29T04:00:00Z",
  "location": {
    "latitude": 26.32,
    "longitude": -98.32,
    "farm_name": "Mission, Texas representative scenario site",
    "location_label": "Mission, Texas",
    "source": "manual_coordinates"
  },
  "planting": {
    "planned_month": "2026-08",
    "flexibility_days": 30
  },
  "requested_crop_id": "grain_sorghum",
  "irrigation": {
    "availability": "yes",
    "reliability": "reliable",
    "method": "unknown",
    "water_source": "unknown",
    "notes": "Synthetic reliable-irrigation assumption for deterministic scenario testing."
  }
}
