{
  "schema_version": "1.0.0",
  "profile_id": "central_blackland_temple_out_of_season",
  "captured_at": "2026-08-29T04:00:00Z",
  "location": {
    "latitude": 31.16,
    "longitude": -97.39,
    "farm_name": "Temple, Texas representative scenario site",
    "location_label": "Temple, Texas",
    "source": "manual_coordinates"
  },
  "planting": {
    "planned_month": "2027-05",
    "flexibility_days": 30
  },
  "requested_crop_id": "white_potato",
  "irrigation": {
    "availability": "yes",
    "reliability": "limited",
    "method": "unknown",
    "water_source": "unknown",
    "notes": "Synthetic baseline assumption for deterministic scenario testing."
  }
}
