{
  "schema_version": "1.0.0",
  "profile_id": "lrgv_mid_weslaco_no_irrigation",
  "captured_at": "2026-08-29T04:00:00Z",
  "location": {
    "latitude": 26.19,
    "longitude": -97.99,
    "farm_name": "Weslaco, Texas representative scenario site",
    "location_label": "Weslaco, Texas",
    "source": "manual_coordinates"
  },
  "planting": {
    "planned_month": "2026-08",
    "flexibility_days": 30
  },
  "requested_crop_id": "grain_sorghum",
  "irrigation": {
    "availability": "no",
    "reliability": "not_applicable",
    "notes": "Synthetic no-irrigation assumption for deterministic scenario testing."
  }
}
