{
  "schema_version": "1.0.0",
  "profile_id": "plains_south_plainview_no_irrigation",
  "captured_at": "2026-08-29T04:00:00Z",
  "location": {
    "latitude": 34.18,
    "longitude": -101.79,
    "farm_name": "Plainview, Texas representative scenario site",
    "location_label": "Plainview, Texas",
    "source": "manual_coordinates"
  },
  "planting": {
    "planned_month": "2026-08",
    "flexibility_days": 30
  },
  "requested_crop_id": "white_potato",
  "irrigation": {
    "availability": "no",
    "reliability": "not_applicable",
    "notes": "Synthetic no-irrigation assumption for deterministic scenario testing."
  }
}
