{
  "schema_version": "1.0.0",
  "profile_id": "central_winter_garden_uvalde_out_of_season",
  "captured_at": "2026-08-29T04:00:00Z",
  "location": {
    "latitude": 29.24,
    "longitude": -99.76,
    "farm_name": "Uvalde, Texas representative scenario site",
    "location_label": "Uvalde, Texas",
    "source": "manual_coordinates"
  },
  "planting": {
    "planned_month": "2027-05",
    "flexibility_days": 30
  },
  "requested_crop_id": "white_potato",
  "irrigation": {
    "availability": "yes",
    "reliability": "limited",
    "method": "unknown",
    "water_source": "unknown",
    "notes": "Synthetic baseline assumption for deterministic scenario testing."
  }
}
